{
  "name": "isRulestackCommitClean",
  "revision": 1,
  "status": "proposed",
  "definition": "True when no rulestack that a managed firewall uses has uncommitted candidate changes, so the policy the firewall enforces equals the last committed configuration.",
  "valueType": "boolean",
  "unit": "none",
  "population": "rulestacks used by the managed firewalls; rulestacks no firewall uses are ignored; denominator = every firewall read",
  "polarity": "good_when_true",
  "evidenceRequiredForTrue": "A complete read of every firewall and of the rulestack list, with the list carrying its uncommitted array and none of the used rulestacks in it.",
  "evidenceClass": "configured",
  "notMeasured": {
    "value": null,
    "envelope": "additionalInfo.dataCollection.status == \"error\""
  },
  "emptyPopulationMeans": "not_measured",
  "allowedCategories": [
    "Firewalls"
  ],
  "integrationPolicy": "any",
  "allowedIntegrations": [],
  "aliases": [],
  "owner": "unknown",
  "validation": {
    "level": "V0",
    "implementations": []
  },
  "citations": [
    "safeguards/firewalls/palo-alto-cloud-ngfw/isRulestackCommitClean.py and its test file (synthetic fixtures)",
    "Public OpenAPI reference for Cloud NGFW for AWS, pan.dev openapi-specs/cloudngfw/aws (ManageNGFW, ManageRulestacks, ManageCertificateObjects), rendered at https://pan.dev/cloudngfw/aws/api/"
  ],
  "changeLog": [
    {
      "revision": 1,
      "date": "2026-10-12",
      "change": "Registered so the Cloud NGFW transform can emit it. Meaning written from the public reference only; no customer read, so the key stays proposed and V0."
    }
  ],
  "notes": "Answers only a tool that has a commit step between candidate and running policy. Whether other firewall tools should answer this key is not ruled."
}
