{
  "name": "epssHighRiskOpenVulnerabilitiesCount",
  "revision": 1,
  "status": "proposed",
  "definition": "The number of currently open vulnerabilities the scanner places in its high EPSS (exploit prediction) bucket across the in-scope assets; 0 only from a complete read.",
  "valueType": "integer",
  "unit": "count",
  "population": "every non-deprecated asset the scanner lists, across every company the API user can see; the value is the sum over that population",
  "polarity": "lower_is_better",
  "evidenceRequiredForTrue": "A complete read (every page, no truncation flag, row total reached) of every active asset, each reporting an integer count; zero only when every active asset reports zero.",
  "evidenceClass": "measured",
  "notMeasured": {
    "value": null,
    "envelope": "additionalInfo.dataCollection.status == \"error\""
  },
  "emptyPopulationMeans": "not_measured",
  "allowedCategories": [
    "Threat & Vulnerability Management"
  ],
  "integrationPolicy": "any",
  "allowedIntegrations": [],
  "aliases": [],
  "owner": "unknown",
  "validation": {
    "level": "V0",
    "implementations": []
  },
  "citations": [
    "safeguards/threat-vulnerability-management/connectsecure/ (the six transforms and test_connectsecure.py)",
    "ConnectSecure public Swagger, GET /r/asset/asset_view: <pod>/apidocs/swagger.yaml (each vendor pod publishes it), see https://cybercns.atlassian.net/wiki/spaces/CVB/pages/2128314664/V4+API+Information (read 2026-10-12)"
  ],
  "changeLog": [
    {
      "revision": 1,
      "date": "2026-10-12",
      "change": "Registered so the ConnectSecure transforms can emit it. The meaning is the catalogue description made precise; unverified fields are named in the transform docstring."
    }
  ],
  "notes": "Registered for the ConnectSecure transforms. Other vendors' transforms already emit this key (Intruder, Rapid7, Action1, Amazon Inspector); whether they measure the same population was not reviewed, so the key stays proposed and V0 and the owner is not yet named. The EPSS threshold is the vendor's own and is not stated in its public API description."
}
