{
  "name": "areExploitablePathsRemediated",
  "revision": 1,
  "status": "proposed",
  "definition": "True when every gap with an accepted exploitable or conditionally exploitable verdict has a status of Planned, In Progress, Completed or Risk Accepted.",
  "valueType": "boolean",
  "unit": "none",
  "population": "gaps whose accepted verdict confirms a live path, within a collection holding at least one accepted, conclusive verdict",
  "polarity": "good_when_true",
  "evidenceRequiredForTrue": "At least one accepted, conclusive verdict in the collection, and every accepted live-path gap off Not Started. With accepted verdicts and no confirmed live path there is nothing to remediate, which is compliant.",
  "evidenceClass": "unknown",
  "notMeasured": {
    "value": null,
    "envelope": "additionalInfo.dataCollection.status == \"error\""
  },
  "emptyPopulationMeans": "compliant",
  "allowedCategories": [],
  "integrationPolicy": "any",
  "allowedIntegrations": [],
  "aliases": [],
  "owner": "unknown",
  "validation": {
    "level": "V0",
    "implementations": []
  },
  "citations": [
    "safeguards/exploitpathverification/spektrum/epv_transform.py",
    "safeguards/exploitpathverification/spektrum/areexploitablepathsremediated.py"
  ],
  "changeLog": [
    {
      "revision": 1,
      "date": "2026-10-16",
      "change": "Registered with the Exploit Path Verification transforms; proposed, no requirement reads it yet."
    }
  ],
  "notes": "Input is Spektrum's own Exploit Path Verification output (verdicts on gap tokens, Integration-Service src/schemas/epv.py), not a vendor response. An accepted verdict is an analyst's attestation over an analysis Spektrum computed, so the transform reports proofLevel 1: the party that produced the analysis cannot also certify it. Only verdicts with reviewState accepted count; pending, rejected, superseded and accepted-indeterminate verdicts settle nothing. allowedCategories is empty because gap verdicts are cross-category evidence (a passport's gaps span every safeguard category); no integration answers these keys today, so no RTA row maps them yet."
}
