{
  "name": "isExploitPathVerificationEnabled",
  "revision": 1,
  "status": "proposed",
  "definition": "True when at least one gap in the passport's gap collection carries an Exploit Path Verification verdict that a person accepted and that reached a conclusion.",
  "valueType": "boolean",
  "unit": "none",
  "population": "gap tokens in one passport's latest gap collection; a gap is an entry carrying a gapUid",
  "polarity": "good_when_true",
  "evidenceRequiredForTrue": "A readable gap collection holding at least one gap whose additionalInformation.exploitPathVerification has reviewState accepted and a verdict of exploitable, conditionally_exploitable, blocked, not_exploitable or contained.",
  "evidenceClass": "presence",
  "notMeasured": {
    "value": null,
    "envelope": "additionalInfo.dataCollection.status == \"error\""
  },
  "emptyPopulationMeans": "not_measured",
  "allowedCategories": [],
  "integrationPolicy": "any",
  "allowedIntegrations": [],
  "aliases": [],
  "owner": "unknown",
  "validation": {
    "level": "V0",
    "implementations": []
  },
  "citations": [
    "safeguards/exploitpathverification/spektrum/epv_transform.py"
  ],
  "changeLog": [
    {
      "revision": 1,
      "date": "2026-10-16",
      "change": "Registered with the Exploit Path Verification transforms; proposed, no requirement reads it yet."
    }
  ],
  "notes": "Input is Spektrum's own Exploit Path Verification output (verdicts on gap tokens, Integration-Service src/schemas/epv.py), not a vendor response. An accepted verdict is an analyst's attestation over an analysis Spektrum computed, so the transform reports proofLevel 1: the party that produced the analysis cannot also certify it. Only verdicts with reviewState accepted count; pending, rejected, superseded and accepted-indeterminate verdicts settle nothing. allowedCategories is empty because gap verdicts are cross-category evidence (a passport's gaps span every safeguard category); no integration answers these keys today, so no RTA row maps them yet."
}
